chapter,verse,sanskrit,transliteration,english_meaning,application
1,1,"धृतराष्ट्र उवाच | धर्मक्षेत्रे कुरुक्षेत्रे समवेता युयुत्सवः | मामकाः पाण्डवाश्चैव किमकुर्वत सञ्जय ||१-१||","dhṛitarāśhtṛa uvācha dharma-kṣhetre kuru-kṣhetre samavetā yuyutsavaḥ māmakāḥ pāṇḍavāśhchaiva kimakurvata sañjaya","Dhritarashtra said: O Sanjaya, what did my sons and the sons of Pandu do when they assembled on the holy field of Kurukshetra, eager for battle?","Before important events (like a major project launch, a difficult conversation, or starting a new venture), pause and reflect on your motivations, the potential outcomes, and the ethical considerations involved. Understanding the 'why' behind your intended actions helps clarify choices and anticipate consequences, just as Dhritarashtra sought to understand the situation unfolding on the 'field of duty'."
1,2,"सञ्जय उवाच | दृष्ट्वा तु पाण्डवानीकं व्यूढं दुर्योधनस्तदा | आचार्यमुपसङ्गम्य राजा वचनमब्रवीत् ||१-२||","sañjaya uvācha dṛiṣhṭvā tu pāṇḍavānīkaṁ vyūḍhaṁ duryodhanastadā āchāryamupasaṅgamya rājā vachanamabravīt","Sanjaya said: Seeing the army of the Pandavas arrayed for battle, King Duryodhana approached his teacher Drona and spoke these words.","When facing complex challenges or critical decisions (e.g., career changes, major investments, ethical dilemmas), don't rely solely on your own perspective, especially if feeling pressured. Actively seek counsel from experienced mentors, teachers, or trusted advisors. Their wisdom can offer valuable insights, strategic alternatives, and help avoid potential pitfalls born from a biased or limited viewpoint, just as Duryodhana instinctively turned to his teacher Drona."
2,14,"मात्रास्पर्शास्तु कौन्तेय शीतोष्णसुखदुःखदाः | आगमापायिनोऽनित्यास्तांस्तितिक्षस्व भारत ||२-१४||","mātrā-sparśhās tu kaunteya śhītoṣhṇa-sukha-duḥkha-dāḥ āgamāpāyino ’nityās tānstitikṣhasva bhārata","O son of Kunti, the contact between the senses and the sense objects gives rise to fleeting perceptions of happiness and distress. These are non-permanent, and come and go like the winter and summer seasons. O descendent of Bharat, one must learn to tolerate them without being disturbed.","Cultivate emotional resilience by recognizing that life's ups and downs (e.g., exam stress, project deadlines, job insecurity, fluctuating relationships, fleeting praise or criticism) are temporary, like changing seasons. Practice accepting discomfort ('titiksha') without being mentally overwhelmed. Focus on your stable inner self and long-term goals, rather than being excessively swayed by transient sensory experiences of pleasure or pain. This builds inner strength."
2,41,"व्यवसायात्मिका बुद्धिरेकेह कुरुनन्दन | बहुशाखा ह्यनन्ताश्च बुद्धयोऽव्यवसायिनाम् ||२-४१||","vyavasāyātmikā buddhir ekeha kuru-nandana bahu-śhākhā hy anantāśh cha buddhayo ’vyavasāyinām","Those who are resolute have a single-pointed focus, O Arjuna. The thoughts of the irresolute are endless and branch in all directions.","Prioritize single-pointed focus ('ekehā') in your key endeavors, whether mastering a skill, pursuing a career path, completing studies, or working on a specific project. Avoid scattering your mental energy ('bahu-śhākhā') through excessive multitasking or constantly shifting goals without completion. A resolute mind, fixed on a clear, well-defined objective, achieves far more effectively and efficiently than an irresolute one pulled in countless directions."
2,47,"कर्मण्येवाधिकारस्ते मा फलेषु कदाचन | मा कर्मफलहेतुर्भूर्मा ते सङ्गोऽस्त्वकर्मणि ||२-४७||","karmaṇy-evādhikāras te mā phaleṣhu kadāchana mā karma-phala-hetur bhūr mā te saṅgo 'stv akarmaṇi","You have a right to perform your prescribed duties, but you are not entitled to the fruits of your actions. Never consider yourself to be the cause of the results of your activities, and never be attached to inaction.","Dedicate yourself fully to performing your responsibilities (at work, in studies, within family, personal growth) to the best of your ability ('adhikāras te karmaṇi'), but consciously relinquish attachment to the specific outcomes or rewards ('mā phaleṣhu kadāchana'). Focus on the quality, integrity, and effort of your actions. This mindset reduces performance anxiety, fosters excellence regardless of external validation, prevents discouragement from setbacks, and avoids the trap of inaction ('sango 'stu akarmaṇi') born from fear of failure."
2,48,"योगस्थः कुरु कर्माणि सङ्गं त्यक्त्वा धनञ्जय | सिद्ध्यसिद्ध्योः समो भूत्वा समत्वं योग उच्यते ||२-४८||","yoga-sthaḥ kuru karmāṇi saṅgaṁ tyaktvā dhanañjaya siddhy-asiddhyoḥ samo bhūtvā samatvaṁ yoga uchyate","Perform your duty equipoised, O Arjuna, abandoning all attachment to success or failure. Such equanimity is called yoga.","Strive for emotional equanimity ('samatvam') while performing your actions ('kuru karmāṇi'). Whether facing success ('siddhi') or failure ('asiddhi'), praise or criticism, gain or loss, remain internally balanced and centered ('samo bhūtvā'), having abandoned attachment ('saṅgaṁ tyaktvā'). This mental poise ('yoga') allows for clearer thinking, better decision-making unbiased by emotional reactions, and fosters lasting inner peace regardless of external circumstances."
2,50,"बुद्धियुक्तो जहातीह उभे सुकृतदुष्कृते | तस्माद्योगाय युज्यस्व योगः कर्मसु कौशलम् ||२-५०||","buddhi-yukto jahātīha ubhe sukṛita-duṣhkṛite tasmād yogāya yujyasva yogaḥ karmasu kauśhalam","One who is wise lets go of all results of good and bad actions. Thus, focus on yoga (skillful living), for yoga is the art of working with excellence.","True skill in action ('yogah karmasu kauśhalam') involves executing your tasks with intelligence and excellence ('buddhi-yukto'), free from attachment to the results, whether deemed 'good' ('sukṛita') or 'bad' ('duṣhkṛite'). Focus on refining your craft, whether in your profession, studies, or personal projects, acting skillfully and ethically without being driven by ego or the anxiety of outcomes. This ""skillful living"" transcends the duality of success and failure."
3,19,"तस्मादसक्तः सततं कार्यं कर्म समाचर | असक्तो ह्याचरन्कर्म परमाप्नोति पूरुषः ||३-१९||","tasmād asaktaḥ satataṁ kāryaṁ karma samāchara asakto hy ācharan karma param āpnoti pūruṣhaḥ","Therefore, perform your duties without attachment, remaining steadfast in yoga. By working without attachment, one attains the Supreme.","Engage consistently ('satatam') and diligently in your required duties ('kāryaṁ karma samāchara') without being attached ('asaktaḥ') to personal gain, recognition, or specific results. Acting selflessly and steadily, simply because it is the right thing to do ('kāryam'), purifies the mind and aligns you with higher principles or your true nature ('param āpnoti'), leading ultimately to inner fulfillment and excellence."
4,8,"परित्राणाय साधूनां विनाशाय च दुष्कृताम् | धर्मसंस्थापनार्थाय सम्भवामि युगे युगे ||४-८||","paritrāṇāya sādhūnāṁ vināśhāya cha duṣhkṛitām dharma-sansthāpanārthāya sambhavāmi yuge yuge","To protect the righteous, to annihilate the wicked, and to reestablish the principles of dharma I appear millennium after millennium.","Be inspired to actively uphold righteousness ('dharma') in your own sphere of influence. Stand up for ethical principles, support and protect the vulnerable or those acting virtuously ('sādhūnām'), and challenge wrongdoing or unethical practices ('duṣkṛitām') when you encounter them (e.g., in the workplace, community, or personal interactions). Understand that maintaining moral order ('dharma-sansthāpanārthāya') requires conscious effort, courage, and active participation."
5,23,"शक्नोतीहैव यः सोढुं प्राक्शरीरविमोक्षणात् | कामक्रोधोद्भवं वेगं स युक्तः स सुखी नरः ||५-२३||","śhaknotīhaiva yaḥ soḍhuṁ prāk śharīra-vimokṣhaṇāt kāma-krodhodbhavaṁ vegaṁ sa yuktaḥ sa sukhī naraḥ","One who can withstand the urges of lust and anger before death is a true yogi and is happy.","Recognize the powerful impulses ('vegam') arising from desire ('kāma') and anger ('krodha'). True strength, inner peace ('sa sukhi narah'), and stability ('sa yuktah') come from developing the capacity to withstand ('soḍhuṁ') these urges *before* they overpower your judgment and actions, even while living ('ihaiva...prāk śharīra-vimokṣhaṇāt'). Practice self-control in daily life (e.g., managing impulsive reactions, resisting instant gratification, handling frustration constructively) to build this inner resilience."
6,5,"उद्धरेदात्मनात्मानं नात्मानमवसादयेत् | आत्मैव ह्यात्मनो बन्धुरात्मैव रिपुरात्मनः ||६-५||","uddhared ātmanātmānaṁ nātmānam avasādayet ātmaiva hy ātmano bandhur ātmaiva ripur ātmanaḥ","Elevate yourself by your own mind; do not degrade yourself. The mind is both friend and enemy.","Take conscious responsibility for your own upliftment ('uddhared ātmanātmānam') through the power of your own mind and efforts. Do not let your mind drag you down ('nātmānam avasādayet'). Your mind can be your greatest ally ('bandhu'), fostering growth, focus, and resilience when disciplined and positive. Conversely, an uncontrolled mind filled with negativity, doubt, and distraction becomes your greatest obstacle ('ripu'). Actively cultivate self-awareness and mental discipline to make your mind your friend."
6,17,"युक्ताहारविहारस्य युक्तचेष्टस्य कर्मसु | युक्तस्वप्नावबोधस्य योगो भवति दुःखहा ||६-१७||","yuktāhāra-vihārasya yukta-cheṣhṭasya karmasu yukta-svapnāvabodhasya yogo bhavati duḥkha-hā","One who is regulated in diet, recreation, work, sleep, and wakefulness attains yoga, which destroys all sorrow.","Cultivate moderation and balance ('yukta') in all aspects of daily life: eating habits ('āhāra'), recreation and movement ('vihāra'), effort in work ('cheṣṭasya karmasu'), and sleep/wake cycles ('svapnāvabodhasya'). Extremes in any area disrupt inner equilibrium and hinder mental clarity and peace ('yoga'). A regulated, balanced lifestyle is the foundation for well-being, resilience, and effectively managing life's stresses ('duḥkha-hā' - destroying sorrow)."
12,13,"अद्वेष्टा सर्वभूतानां मैत्रः करुण एव च | निर्ममो निरहङ्कारः समदुःखसुखः क्षमी ||१२-१३||","adveṣhṭā sarva-bhūtānāṁ maitraḥ karuṇa eva cha nirmamo nirahankāraḥ sama-duḥkha-sukhaḥ kṣhamī","One who is not envious but is a kind friend to all living entities, who does not think himself a proprietor and is free from false ego, who is equal in both happiness and distress, who is forgiving...","Actively cultivate these qualities in your daily interactions and inner attitude: Be non-envious and genuinely happy for others ('adveṣṭā'), cultivate universal friendliness ('maitraḥ') and compassion ('karuṇaḥ') towards all beings. Practice letting go of possessiveness ('nirmamaḥ') and false ego ('nirahankāraḥ'). Strive for emotional balance, remaining equipoised in joy and sorrow ('sama-duḥkha-sukhaḥ'), and develop a forgiving nature ('kṣhamī'). These virtues foster harmony and inner peace."
12,16,"अनपेक्षः शुचिर्दक्ष उदासीनो गतव्यथः | सर्वारम्भपरित्यागी यो मद्भक्तः स मे प्रियः ||१२-१६||","anapekṣhaḥ śhuchir dakṣha udāsīno gata-vyathaḥ sarvārambha-parityāgī yo mad-bhaktaḥ sa me priyaḥ","My devotee who is free from expectations, pure, skilled, impartial, untroubled, and renounces all undertakings is dear to Me.","Strive to embody these qualities: Be free from dependence on external outcomes or expectations ('anapekṣhaḥ'), maintain inner and outer purity ('śhuchiḥ'), be skillful and efficient in your actions ('dakṣhaḥ'), remain impartial and objective ('udāsīnaḥ'), stay untroubled and free from mental anguish ('gata-vyathaḥ'), and renounce the egoistic attachment behind initiating actions purely for personal gain ('sarvārambha-parityāgī'). These foster inner freedom and purposeful action."
18,26,"मुक्तसङ्गोऽनहंवादी धृत्युत्साहसमन्वितः | सिद्ध्यसिद्ध्योर्निर्विकारः कर्ता सात्त्विक उच्यते ||१८-२६||","mukta-saṅgo ’nahaṁvādī dhṛity-utsāha-samanvitaḥ siddhy-asiddhyor nirvikāraḥ kartā sāttvika uchyate","A doer who is free from attachment, non-egotistic, endowed with resolve and enthusiasm, and unaffected by success or failure is said to be sattvic (pure).","Embody the qualities of a 'Sattvic' (acting from clarity and goodness) doer in your work and life: Perform actions with determination ('dhṛiti') and enthusiasm ('utsāha'), but remain free from attachment ('mukta-saṅgaḥ') and egoism ('anahaṁvādī' - not boasting ""I did this""). Crucially, stay unaffected and maintain composure whether the outcome is success or failure ('siddhy-asiddhyor nirvikāraḥ'). This approach ensures clarity, resilience, ethical conduct, and sustained effort."
18,78,"यत्र योगेश्वरः कृष्णो यत्र पार्थो धनुर्धरः | तत्र श्रीर्विजयो भूतिर्ध्रुवा नीतिर्मतिर्मम ||१८-७८||","yatra yogeśhvaraḥ kṛiṣhṇo yatra pārtho dhanurdharaḥ tatra śhrīr vijayo bhūtir dhruvā nītir matir mama","Wherever there is Krishna, the master of all mystics, and wherever there is Arjuna, the supreme archer, there will also certainly be opulence, victory, extraordinary power, and morality. That is my opinion.","Recognize that true success, prosperity ('śrīḥ'), victory ('vijayaḥ'), well-being ('bhūtiḥ'), and sound policy ('dhruvā nītiḥ') emerge when divine wisdom, guidance, and purpose (represented by Krishna, the 'Yogeśhvara') are combined with skillful, courageous, and dedicated action (represented by Arjuna, the 'Dhanurdhara'). In your own life and work, strive to align your actions with ethical principles and wise counsel, ensuring that your efforts are both well-intentioned and effectively executed."
3,37,"काम एष क्रोध एष रजोगुणसमुद्भवः | महाशनो महापाप्मा विद्ध्येनमिह वैरिणम् ||३-३७||","kāma eṣha krodha eṣha rajo-guṇa-samudbhavaḥ mahāśhano mahā-pāpmā viddhyenam iha vairiṇam","It is lust alone, which is born of contact with the mode of passion, and later transformed into anger. Know this as the sinful, all-devouring enemy in the world.","Be vigilant against the internal enemies: intense, selfish desire ('kāma') and anger ('krodha'), which arise from the activating, turbulent quality of nature ('rajo-guṇa'). Understand that unchecked desire often leads to frustration and anger when thwarted. Recognize these powerful, insatiable ('mahāśhanaḥ'), and destructive ('mahāpāpmā') emotions as primary obstacles ('vairiṇam') to peace, clarity, and ethical conduct. Self-awareness is the first step to managing them."
9,22,"अनन्याश्चिन्तयन्तो मां ये जनाः पर्युपासते | तेषां नित्याभियुक्तानां योगक्षेमं वहाम्यहम् ||९-२२||","ananyāśh chintayanto māṁ ye janāḥ paryupāsate teṣhāṁ nityābhiyuktānāṁ yoga-kṣhemaṁ vahāmyaham","To those who worship Me with devotion, meditating on Me alone, I provide for all their needs and secure what they lack.","When you wholeheartedly dedicate your thoughts and actions ('ananyāś cintayanto') to a higher purpose, ethical principle, or spiritual goal ('mām'), cultivating unwavering focus and constant engagement ('nityābhiyuktānām'), trust that your essential needs ('kṣhemam' - security, well-being) will be met and your progress ('yogam' - acquisition of what is lacking) will be facilitated ('vahāmyaham'). This implies focusing fully on your duty and devotion, allowing the universal order or divine grace to support your journey."
10,20,"अहमात्मा गुडाकेश सर्वभूताशयस्थितः | अहमादिश्च मध्यं च भूतानामन्त एव च ||१०-२०||","aham ātmā guḍākeśha sarva-bhūtāśhaya-sthitaḥ aham ādiśh cha madhyaṁ cha bhūtānām anta eva cha","I am the Self, O Arjuna, seated in the hearts of all creatures. I am the beginning, the middle, and the end of all beings.","Cultivate the awareness that the same divine essence or Self ('Ātmā') resides within the hearts ('sarva-bhūtāśhaya-sthitaḥ') of all living beings, including yourself. Recognize this universal presence as the source ('ādi'), sustainer ('madhyam'), and ultimate dissolution point ('anta') of all existence. This perspective fosters deep reverence, empathy, and a sense of interconnectedness with all life, transforming how you relate to others and the world, dissolving alienation and prejudice."
13,8,"अमानित्वमदम्भित्वमहिंसा क्षान्तिरार्जवम् | आचार्योपासनं शौचं स्थैर्यमात्मविनिग्रहः ||१३-८||","amānitvam adambhitvam ahinsā kṣhāntir ārjavam āchāryopāsanaṁ śhauchaṁ sthairyam ātma-vinigrahaḥ","Humility, unpretentiousness, non-violence, forgiveness, uprightness, service to the teacher, purity, steadfastness, self-control.","Understand that virtues like humility ('amānitvam'), lack of pretense ('adambhitvam'), non-violence ('ahimsā'), forgiveness ('kṣhāntiḥ'), uprightness ('ārjavam'), respect for teachers ('āchāryopāsanam'), purity ('śhaucam'), steadfastness ('sthairyam'), and self-control ('ātma-vinigrahaḥ') are not merely ethical ideals but essential components of true knowledge and wisdom. Actively cultivate these qualities daily in your thoughts, words, and actions, as they prepare the mind and heart for deeper understanding."
14,22,"प्रकाशं च प्रवृत्तिं च मोहमेव च पाण्डव | न द्वेष्टि सम्प्रवृत्तानि न निवृत्तानि काङ्क्षति ||१४-२२||","prakāśhaṁ cha pravṛittiṁ cha moham eva cha pāṇḍava na dveṣhṭi sampravṛittāni na nivṛittāni kāṅkṣhati","The one who is undisturbed by illumination, activity, or delusion; who neither desires nor hates their presence.","Strive to become an impartial witness to the interplay of the three Gunas (modes of nature) within and around you: the clarity and illumination of Sattva ('prakāśham'), the activity and passion of Rajas ('pravṛittim'), and the delusion and inertia of Tamas ('moham'). Develop the inner stability ('na dveṣṭi... na kāṅkṣhati') to remain undisturbed whether these qualities are manifesting ('sampravṛittāni') or subsiding ('nivṛittāni'), neither craving the pleasant effects of Sattva nor hating the challenging aspects of Rajas and Tamas. This transcendence leads to steady wisdom."
15,7,"ममैवांशो जीवलोके जीवभूतः सनातनः | मनःषष्ठानीन्द्रियाणि प्रकृतिस्थानि कर्षति ||१५-७||","mamaivānśho jīva-loke jīva-bhūtaḥ sanātanaḥ manaḥ-ṣhaṣhṭhānīndriyāṇi prakṛiti-sthāni karṣhati","The eternal souls in this world are My fragmental parts, but they struggle with the six senses including the mind.","Recognize your fundamental nature as an eternal fragment ('sanātanaḥ mama eva anśaḥ') of the Divine, temporarily embodied as a living being ('jīva-bhūtaḥ') in this world ('jīva-loke'). Understand that the feeling of struggle arises from entanglement with the mind and five senses ('manaḥ-ṣhaṣhṭhāni indriyāṇi'), which are rooted in material nature ('prakṛiti-sthāni karṣhati'). This awareness is the starting point for self-realization – disentangling consciousness from the limited mind/senses to reclaim your true, divine identity."
16,1,"अभयं सत्त्वसंशुद्धिर्ज्ञानयोगव्यवस्थितिः | दानं दमश्च यज्ञश्च स्वाध्यायस्तप आर्जवम् ||१६-१||","abhayaṁ sattva-sanśhuddhir jñāna-yoga-vyavasthitiḥ dānaṁ damaśh cha yajñaśh cha svādhyāyas tapa ārjavam","Fearlessness, purity of heart, steadfastness in knowledge, charity, self-control, sacrifice, study of scriptures, austerity, simplicity.","Consciously cultivate the 'divine qualities' ('Daivi Sampat') that lead to liberation and well-being: fearlessness ('abhayam'), purity of inner being ('sattva-sanśuddhiḥ'), consistent engagement with knowledge ('jñāna-yoga-vyavasthitiḥ'), generosity ('dānam'), control of the senses ('damaḥ'), performing duties as sacrifice ('yajñaḥ'), study of wisdom texts ('svādhyāyaḥ'), self-discipline ('tapaḥ'), and straightforwardness ('ārjavam'). Nurture these as practical virtues for inner growth."
17,15,"अनुद्वेगकरं वाक्यं सत्यं प्रियहितं च यत् | स्वाध्यायाभ्यसनं चैव वाङ्मयं तप उच्यते ||१७-१५||","anudvega-karaṁ vākyaṁ satyaṁ priya-hitaṁ cha yat svādhyāyābhyasanaṁ chaiva vāṅ-mayaṁ tapa uchyate","Speech that causes no distress, is truthful, pleasant, and beneficial, along with regular recitation of scriptures—this is the austerity of speech.","Practice the 'austerity of speech' ('vāṅ-mayaṁ tapaḥ') by ensuring your communication ('vākyaṁ') is: non-agitating ('anudvega-karam'), truthful ('satyam'), pleasant ('priyam'), and beneficial ('hitam'). Avoid gossip, harshness, lies, or useless talk. Complement this with regular study/recitation of wisdom literature ('svādhyāyābhyasanam'). Mindful, constructive speech conserves energy, builds trust, and fosters positive environments."
18,58,"मच्चित्तः सर्वदुर्गाणि मत्प्रसादात्तरिष्यसि | अथ चेत्त्वमहङ्कारान्न श्रोष्यसि विनङ्क्ष्यसि ||१८-५८||","mach-chittaḥ sarva-durgāṇi mat-prasādāt tariṣhyasi atha chet tvam ahankārān na śhroṣhyasi vinaṅkṣhyasi","Fix your mind on Me, and by My grace you will overcome all obstacles. But if from ego you refuse to listen, you will perish.","When facing significant obstacles or difficult situations ('sarva-durgāṇi'), consciously fix your mind ('mach-chittaḥ') on your highest ideal, purpose, or the Divine. Trust that by aligning yourself with this higher wisdom and acting with humility, you will receive the insight and strength ('mat-prasādāt') to overcome them ('tariṣhyasi'). Conversely, recognize that acting solely from ego ('ahaṅkārāt'), refusing guidance or higher perspective ('na śroṣhyasi'), leads to errors, confusion, and potential failure ('vinaṅkṣhyasi')."
