chapter,verse,sanskrit,transliteration,english_meaning,application
6,1,"श्रीभगवानुवाच | अनाश्रितः कर्मफलं कार्यं कर्म करोति यः | स संन्यासी च योगी च न निरग्निर्न चाक्रियः ||६-१||","śhrī bhagavān uvācha anāśhritaḥ karma-phalaṁ kāryaṁ karma karoti yaḥ sa sannyāsī cha yogī cha na niragnir na chākriyaḥ","One who performs duty without dependence on results is a true renunciant and yogi—not one who abandons fire or action.","Understand that a true renunciant ('Sannyāsī') and a true Yogi is not defined by external appearances, such as abandoning traditional duties (like maintaining the sacred fire - 'na niragniḥ') or merely ceasing all activity ('na chākriyaḥ'). Rather, the true Yogi is one who performs their obligatory duty ('kāryaṁ karma karoti yaḥ') without being dependent on or attached to the fruits or results of that action ('anāśritaḥ karma-phalam'). Integrate mindful action with inner detachment in your daily life to embody this principle."
6,35,"असंशयं महाबाहो मनो दुर्निग्रहं चलम् | अभ्यासेन तु कौन्तेय वैराग्येण च गृह्यते ||६-३५||","asanśhayaṁ mahā-bāho mano durnigrahaṁ chalam abhyāsena tu kaunteya vairāgyeṇa cha gṛihyate","The mind is restless and difficult to restrain, O mighty-armed Arjuna, but through practice and detachment it can be controlled.","Acknowledge without doubt ('asaṁśayam') that the mind ('manaḥ') is indeed restless ('chalam') and difficult to control ('durnigraham'). However, do not despair, as it *can* be brought under control ('gṛihyate') through two primary methods: consistent, patient, and diligent practice ('abhyāsena') – such as meditation, mindfulness, or focused effort – and the cultivation of detachment or dispassion ('vairāgyeṇa') – reducing craving for sense pleasures and aversion to difficulties. These two are the keys to mental mastery."
7,16,"चतुर्विधा भजन्ते मां जनाः सुकृतिनोऽर्जुन | आर्तो जिज्ञासुरर्थार्थी ज्ञानी च भरतर्षभ ||७-१६||","chatur-vidhā bhajante māṁ janāḥ sukṛitino ’rjuna ārto jijñāsur arthārthī jñānī cha bharatarṣhabha","Four types of virtuous people worship Me: the distressed, the seeker of knowledge, the seeker of wealth, and the wise, O Arjuna.","Recognize that people are drawn to spiritual life, self-improvement, or seeking help from a higher power ('bhajante mām') for various valid reasons ('chatur-vidhāḥ'): those suffering or in distress ('ārtaḥ'), those seeking knowledge and understanding ('jijñāsuḥ'), those seeking legitimate worldly needs, security or prosperity ('arthārthī'), and those who possess innate wisdom and seek union ('jñānī'). All these types of sincere seekers ('sukṛitinaḥ') are considered virtuous; honor the validity of different motivations on the path."
7,18,"उदाराः सर्व एवैते ज्ञानी त्वात्मैव मे मतम् | आस्थितः स हि युक्तात्मा मामेवानुत्तमां गतिम् ||७-१८||","udārāḥ sarva evaite jñānī tv ātmaiva me matam āsthitaḥ sa hi yuktātmā mām evānuttamāṁ gatim","All these seekers are noble, but I consider the wise to be My very Self. They are steadfast, united with Me as their supreme goal.","While all four types of seekers mentioned previously are noble and praiseworthy ('udārāḥ sarve eva ete'), the wise individual ('jñānī'), who seeks the Divine out of pure knowledge and selfless love, is considered exceptionally dear, like the Divine's own Self ('tu ātmā eva me matam'). This is because the wise person is steadily established ('āsthitaḥ'), fully integrated ('yukta-ātmā'), and solely focused on the Supreme as the ultimate, unsurpassed goal ('mām eva anuttamāṁ gatim'). Strive to elevate your aspirations towards this state of wisdom and selfless devotion."
8,7,"तस्मात्सर्वेषु कालेषु मामनुस्मर युध्य च | मय्यर्पितमनोबुद्धिर्मामेवैष्यस्यसंशयः ||८-७||","tasmāt sarveṣhu kāleṣhu mām anusmara yudhya cha mayy arpita-mano-buddhir mām evaiṣhyasy asanśhayaḥ","Therefore, remember Me at all times and fight (perform duties). With mind and intellect surrendered to Me, you will surely come to Me.","Therefore ('tasmāt'), strive to constantly remember ('anusmara') your highest ideal or the Divine ('mām') at all times ('sarveṣhu kāleṣhu'), while simultaneously performing your duties and facing life's necessary battles ('yudhya cha'). With your mind and intellect dedicated and surrendered ('mayi arpita-mano-buddhiḥ') to this higher purpose, you will undoubtedly attain the supreme goal ('mām eva eṣhyasi asaṁśayaḥ'). Integrate spiritual awareness seamlessly with active engagement in the world."
9,14,"सततं कीर्तयन्तो मां यतन्तश्च दृढव्रताः | नमस्यन्तश्च मां भक्त्या नित्ययुक्ता उपासते ||९-१४||","satataṁ kīrtayanto māṁ yatantaśh cha dṛiḍha-vratāḥ namasyantaśh cha māṁ bhaktyā nitya-yuktā upāsate","My devotees constantly chant My glories, striving with determination, bowing before Me with devotion, always united with Me.","Engage in practices that foster continuous connection ('nitya-yuktāḥ') and devotion ('upāsate'): regularly remembering, speaking of, or chanting the glories of your ideal ('satatam kīrtayantaḥ mām'), making determined and disciplined efforts ('yatantaḥ cha dṛḍha-vratāḥ') in your practice and duties, approaching with humility, reverence, and loving devotion ('namasyantaḥ cha mām bhaktyā'). Consistency, determination, and heartfelt sincerity are key elements of a thriving devotional or spiritual practice."
9,27,"यत्करोषि यदश्नासि यज्जुहोषि ददासि यत् | यत्तपस्यसि कौन्तेय तत्कुरुष्व मदर्पणम् ||९-२७||","yat karoṣhi yad aśhnāsi yaj juhoṣhi dadāsi yat yat tapasyasi kaunteya tat kuruṣhva mad-arpaṇam","Whatever you do, eat, offer, give away, or perform as austerity, O Arjuna, do it as an offering to Me.","Cultivate an attitude of consecration in all aspects of life. Whatever action you perform ('yat karoṣhi'), whatever you eat or consume ('yad aśnāsi'), whatever ritual or offering you make ('yaj juhoṣhi'), whatever you give away in charity ('dadāsi yat'), whatever discipline or austerity you undertake ('yat tapasyasi') – perform that action consciously as an offering ('tat kuruṣhva mad-arpaṇam') to the Divine or your highest ideal. This practice sanctifies everyday activities, fosters mindfulness, and cultivates detachment from results."
10,4,"बुद्धिर्ज्ञानमसंमोहः क्षमा सत्यं दमः शमः | सुखं दुःखं भवोऽभावो भयं चाभयमेव च ||१०-४||","buddhir jñānam asammohaḥ kṣhamā satyaṁ damaḥ śhamaḥ sukhaṁ duḥkhaṁ bhavo ’bhāvo bhayaṁ chābhayam eva cha","Wisdom, knowledge, clarity, forgiveness, truthfulness, self-control, peacefulness, happiness, distress, birth, death, fear, and fearlessness...","Recognize that the diverse range of qualities and states of being experienced by living entities – such as intelligence ('buddhiḥ'), knowledge ('jñānam'), freedom from delusion ('asammohaḥ'), forgiveness ('kṣhamā'), truthfulness ('satyam'), control of the senses ('damaḥ'), calmness of mind ('śamaḥ'), as well as the dualistic experiences like happiness/distress ('sukham duḥkham'), birth/death ('bhavaḥ abhāvaḥ'), fear/fearlessness ('bhayam cha abhayam') – all ultimately originate from the one Divine Source (as stated in 10.5). This fosters acceptance and inspires cultivation of divine qualities."
10,8,"अहं सर्वस्य प्रभवो मत्तः सर्वं प्रवर्तते | इति मत्वा भजन्ते मां बुधा भावसमन्विताः ||१०-८||","ahaṁ sarvasya prabhavo mattaḥ sarvaṁ pravartate iti matvā bhajante māṁ budhā bhāva-samanvitāḥ","I am the source of all spiritual and material worlds. Everything emanates from Me. The wise who know this worship Me with devotion.","Understand that the ultimate origin ('prabhavaḥ') of all existence, both material and spiritual, is the Divine ('Aham sarvasya'). Everything emanates, functions, and evolves ('sarvam pravartate') from this single source ('mattaḥ'). The wise ('budhāḥ') who grasp this fundamental truth ('iti matvā') engage in worship, service, and devotion ('bhajante mām') with deep conviction and heartfelt feeling ('bhāva-samanvitāḥ'). See the divine underpinning in all fields of knowledge and existence, learning with reverence."
11,33,"तस्मात्त्वमुत्तिष्ठ यशो लभस्व जित्वा शत्रून्भुङ्क्ष्व राज्यं समृद्धम् | मयैवैते निहताः पूर्वमेव निमित्तमात्रं भव सव्यसाचिन् ||११-३३||","tasmāt tvam uttiṣhṭha yaśho labhasva jitvā śhatrūn bhuṅkṣhva rājyaṁ samṛiddham mayaivaite nihatāḥ pūrvam eva nimitta-mātraṁ bhava savya-sāchin","Therefore arise and attain glory! Conquer your enemies and enjoy prosperous rulership. They are already slain by Me—be merely the instrument, O Arjuna.","Therefore, when faced with a necessary and righteous duty, arise ('tasmāt tvam uttiṣṭha')! Act with courage to achieve success and honor ('yaśaḥ labhasva'), overcome your inner and outer obstacles ('jitvā śatrūn'), and fulfill your potential ('bhuṅkṣva rājyaṁ samṛiddham'). Understand that when your actions align with the larger divine will or righteous purpose, the positive outcome is already potentially secured ('maya eva ete nihatāḥ pūrvam eva'). Your role is to act as a willing, conscious, and skillful instrument ('nimitta-mātram bhava') for that purpose to manifest."
12,8,"मय्येव मन आधत्स्व मयि बुद्धिं निवेशय | निवसिष्यसि मय्येव अत ऊर्ध्वं न संशयः ||१२-८||","mayy eva mana ādhatsva mayi buddhiṁ niveśhaya nivasiṣhyasi mayy eva ata ūrdhvaṁ na sanśhayaḥ","Fix your mind on Me alone, immerse your intellect in Me. Thereafter, you shall dwell in Me forever—of this there is no doubt.","Concentrate your mind ('manaḥ') exclusively and steadfastly on your chosen highest ideal or the Divine ('Mayi eva ādhatsva'). Deliberately immerse and absorb your intellect ('buddhim') completely in understanding, contemplating, and connecting with It ('mayi niveśhaya'). By achieving this unified focus of both mind and intellect, you will undoubtedly come to dwell consciously and permanently in that Supreme Reality ('nivasiṣhyasi mayy eva ataḥ ūrdhvam'), free from further divergence or doubt ('na saṁśayaḥ'). This demands dedicated mental discipline."
12,12,"श्रेयो हि ज्ञानमभ्यासाज्ज्ञानाद्ध्यानं विशिष्यते | ध्यानात्कर्मफलत्यागस्त्यागाच्छान्तिरनन्तरम् ||१२-१२||","śhreyo hi jñānam abhyāsāj jñānād dhyānaṁ viśhiṣhyate dhyānāt karma-phala-tyāgas tyāgāch chhāntir anantaram","Knowledge is better than practice, meditation is better than knowledge, renunciation of results is better than meditation—peace immediately follows renunciation.","Understand the hierarchy and progression in spiritual practice for attaining peace: While mechanical practice ('abhyāsāt') is beneficial, informed knowledge ('jñānam') is superior ('śreyaḥ'). Better ('viśiṣhyate') than theoretical knowledge is meditation ('dhyānam') or deep contemplation. Superior even to meditation is the renunciation of the fruits of actions ('dhyānāt karma-phala-tyāgaḥ'). From such complete detachment from outcomes ('tyāgāt'), profound peace ('śāntiḥ') follows swiftly and directly ('anantaram'). Strive towards non-attachment as the most direct path to inner peace."
13,11,"इन्द्रियार्थेषु वैराग्यमनहङ्कार एव च | जन्ममृत्युजराव्याधिदुःखदोषानुदर्शनम् ||१३-११||","indriyārtheṣhu vairāgyam anahaṅkāra eva cha janma-mṛityu-jarā-vyādhi-duḥkha-doṣhānudarśhanam","(Verse 13.11 describes virtues like detachment, lack of ego, seeing faults in material life.)","(The Application provided earlier fits 14.11/13.11 context: 'सर्वद्वारेषु देहेऽस्मिन्...' - 'sarva-dvāreṣhu dehe ’smin...') When the light ('prakāśaḥ') of clarity, understanding, and knowledge ('jñānam') seems to dawn ('upajāyate') through all the gateways of perception (the senses) in the body ('sarva-dvāreṣu dehe asmin'), recognize this ('tadā vidyāt') as a clear sign that the quality of goodness, harmony, and purity ('sattvam') has become predominant ('vivṛddham'). Cultivating sattvic qualities through pure thoughts, ethical actions, and mindful living naturally leads to increased wisdom and perceptual clarity."
14,11,"सर्वद्वारेषु देहेऽस्मिन्प्रकाश उपजायते | ज्ञानं यदा तदा विद्याद्विवृद्धं सत्त्वमित्युत ||१४-११||","sarva-dvāreṣhu dehe ’smin prakāśha upajāyate jñānaṁ yadā tadā vidyād vivṛiddhaṁ sattvam ity uta","When illumination radiates through all the senses, know that sattva predominates.","When clarity, brightness, and the light of knowledge ('prakāśaḥ', 'jñānam') seem to radiate ('upajāyate') through all the gateways of the senses ('sarva-dvāreṣu') in this body ('dehe asmin'), understand ('vidyāt') this experience as a clear indication that the quality of purity, harmony, and goodness ('sattvam') has become predominant ('vivṛddham'). Purity of lifestyle, thoughts, and intentions directly enhances perceptual clarity, understanding, and inner peace."
15,5,"निर्मानमोहा जितसङ्गदोषा अध्यात्मनित्या विनिवृत्तकामाः | द्वन्द्वैर्विमुक्ताः सुखदुःखसंज्ञैर्गच्छन्त्यमूढाः पदमव्ययं तत् ||१५-५||","nir-māna-mohā jita-saṅga-doṣhā adhyātma-nityā vinivṛitta-kāmāḥ dvandvair vimuktāḥ sukha-duḥkha-sanjñair gachchhanty amūḍhāḥ padam avyayaṁ tat","Free from pride and delusion, victorious over evil attachment, ever devoted to the Supreme, liberated from dualities of pleasure and pain—the wise attain that eternal state.","Those who are free from pride ('māna') and delusion ('moha'), have conquered the flaw of unhealthy attachment ('jita-saṅga-doṣāḥ'), are constantly dwelling in spiritual reality ('adhyātma-nityāḥ'), whose material desires have completely ceased ('vinivṛitta-kāmāḥ'), and are liberated from the pairs of opposites like pleasure and pain ('dvandvaiḥ vimuktāḥ sukha-duḥkha-saṁjñaiḥ') – such undeluded souls ('amūḍhāḥ') attain the eternal, imperishable state ('gacchanti padam avyayam tat'). Consciously cultivate these qualities to transcend worldly limitations and find lasting peace."
16,21,"त्रिविधं नरकस्येदं द्वारं नाशनमात्मनः | कामः क्रोधस्तथा लोभस्तस्मादेतत्त्रयं त्यजेत् ||१६-२१||","tri-vidhaṁ narakasyedaṁ dvāraṁ nāśhanam ātmanaḥ kāmaḥ krodhas tathā lobhas tasmād etat trayaṁ tyajet","Lust, anger, and greed are the three gates to hell leading to the soul's degradation. Therefore, one should abandon all three.","Recognize clearly the three primary gateways ('tri-vidham dvāram') leading to suffering ('narakasya') and the degradation of the self ('nāśhanam ātmanaḥ'): intense selfish desire or lust ('kāmaḥ'), anger ('krodhaḥ'), and greed ('lobhaḥ'). Understand their destructive power in your life, relationships, and inner peace. Therefore, make a conscious and determined effort to abandon ('tyajet') these three negative forces through self-awareness, discipline, cultivating contentment, forgiveness, and generosity."
17,16,"मनःप्रसादः सौम्यत्वं मौनमात्मविनिग्रहः | भावसंशुद्धिरित्येतत्तपो मानसमुच्यते ||१७-१६||","manaḥ-prasādaḥ saumyatvaṁ maunam ātma-vinigrahaḥ bhāva-sanśhuddhir ity etat tapo mānasam uchyate","Serenity of mind, gentleness, silence, self-restraint, and purity of purpose—these constitute austerity of the mind.","Practice the true austerity or discipline of the mind ('tapaḥ mānasam') by cultivating: serenity, clarity and cheerfulness of mind ('manaḥ-prasādaḥ'), gentleness in thought and attitude ('saumyatvam'), meaningful inner silence or control over mental chatter ('maunam'), restraint and mastery over the mind ('ātma-vinigrahaḥ'), and purity of intention, motive, and thought ('bhāva-sanśuddhiḥ'). This inner discipline is a powerful form of self-purification that leads to lasting mental peace and clarity."
18,5,"यज्ञदानतपःकर्म न त्याज्यं कार्यमेव तत् | यज्ञो दानं तपश्चैव पावनानि मनीषिणाम् ||१८-५||","yajña-dāna-tapaḥ-karma na tyājyaṁ kāryam eva tat yajño dānaṁ tapaśh chaiva pāvanāni manīṣhiṇām","Acts of sacrifice, charity, and austerity should not be abandoned but performed. These purify even the wise.","Do not abandon the essential practices of sacrifice ('yajña' - selfless service, contribution, rituals for common good), charity ('dāna' - generosity, giving according to capacity), and austerity ('tapaḥ' - discipline, self-control, enduring hardship for a higher purpose). These actions ('karma') must certainly be performed ('na tyājyam, kāryam eva tat'), as they serve as powerful purifiers ('pāvanāni'), elevating the consciousness even of those who are already wise ('manīṣiṇām'). Regularly engage in these three pillars of righteous action."
18,45,"स्वे स्वे कर्मण्यभिरतः संसिद्धिं लभते नरः | स्वकर्मनिरतः सिद्धिं यथा विन्दति तच्छृणु ||१८-४५||","sve sve karmaṇy abhirataḥ sansiddhiṁ labhate naraḥ sva-karma-nirataḥ siddhiṁ yathā vindati tac chhṛiṇu","By devotion to one's own natural work, every person can attain perfection. Hear how one achieves such perfection.","Each person ('naraḥ') can attain perfection or fulfillment ('sansiddhim labhate') by being wholeheartedly engaged and devoted ('abhirataḥ') in their own natural work or duty ('sve sve karmani'), which is aligned with their innate psychophysical nature (Svadharma). Find fulfillment and achieve your highest potential by focusing on excelling in the work and responsibilities that naturally suit your talents and temperament, rather than pursuing roles or duties that are contrary to your inherent disposition, which often leads to stress and inefficiency."


