chapter,verse,sanskrit,transliteration,english_meaning,application
1,30,"वेपथुश्च शरीरे मे रोमहर्षश्च जायते | गाण्डीवं स्रंसते हस्तात्त्वक्चैव परिदह्यते ||१-३०||","vepathuśh cha śharīre me roma-harṣhaśh cha jāyate gāṇḍīvaṁ sraṁsate hastāt tvak chaiva paridahyate","My body is trembling, my hair is standing on end, my bow Gandiva is slipping from my hand, and my skin is burning all over.","(Verse 1.30 describes Arjuna's physical distress. The Application provided earlier fits 3.22: 'न मे पार्थास्ति कर्तव्यं...' - 'na me pārthāsti kartavyaṁ...') Look to the highest ideal (represented by Krishna's statement in 3.22) as a role model for selfless action. Even when seemingly having achieved everything or having no personal need driving the action ('na me... kartavyam asti', 'nānavāptam avāptavyam'), engaging purposefully in one's duties ('varta eva cha karmaṇi') sets a powerful example and contributes to the world's functioning ('loka-sangraha'). Let your work be performed as a contribution or an offering, detached from personal necessity or gain."
2,62,"ध्यायतो विषयान्पुंसः सङ्गस्तेषूपजायते | सङ्गात्सञ्जायते कामः कामात्क्रोधोऽभिजायते ||२-६२||","dhyāyato viṣhayān puṁsaḥ saṅgas teṣhūpajāyate saṅgāt sañjāyate kāmaḥ kāmāt krodho ’bhijāyate","While contemplating sense objects, attachment develops. From attachment arises desire, and from desire comes anger.","Understand the psychological chain reaction: Mentally dwelling ('dhyāyataḥ') on sense objects or experiences ('viṣhayān') creates attachment ('saṅgaḥ') to them. This attachment ('saṅgāt') inevitably breeds craving or desire ('kāmaḥ') to possess or repeat the experience. When this desire ('kāmāt') is thwarted or obstructed, it easily transforms into anger ('krodhaḥ'). Be mindful of where you habitually place your attention, as this is the root cause of emotional disturbance and entanglement. Guard your thoughts consciously."
4,7,"यदा यदा हि धर्मस्य ग्लानिर्भवति भारत | अभ्युत्थानमधर्मस्य तदात्मानं सृजाम्यहम् ||४-७||","yadā yadā hi dharmasya glānir bhavati bhārata abhyutthānam adharmasya tadātmānaṁ sṛijāmyaham","Whenever righteousness declines and unrighteousness rises, O Bharat, I manifest Myself.","Recognize the cosmic principle that when ethical balance ('dharma') significantly declines ('glāniḥ') and injustice or unrighteousness ('adharma') prevails ('abhyutthānam'), forces naturally arise ('tadātmānaṁ sṛijamyaham' - I manifest Myself) to restore equilibrium. Be inspired by this to become an active participant in upholding ethical conduct and contributing positively, especially during challenging times, thereby aligning yourself with this restorative universal principle."
6,6,"बन्धुरात्मात्मनस्तस्य येनात्मैवात्मना जितः | अनात्मनस्तु शत्रुत्वे वर्तेतात्मैव शत्रुवत् ||६-६||","bandhur ātmātmanas tasya yenātmaivātmanā jitaḥ anātmanas tu śhatrutve vartetātmaiva śhatru-vat","For one who has conquered the mind, it is the best of friends. But for one who has failed, the mind becomes the greatest enemy.","Your relationship with your own mind depends entirely on your level of self-mastery. For one who has conquered the mind through discipline, mindfulness, and self-awareness ('yena ātmaiva ātmanā jitaḥ'), the mind acts as the most reliable friend ('bandhuḥ'), guiding towards constructive goals. But for one who has not achieved self-control ('anātmanaḥ'), the very same mind acts like an enemy ('śhatruvat'), working against one's well-being through negativity, distraction, doubt, and harmful impulses. Strive to master your mind."
7,3,"मनुष्याणां सहस्रेषु कश्चिद्यतति सिद्धये | यततामपि सिद्धानां कश्चिन्मां वेत्ति तत्त्वतः ||७-३||","manuṣhyāṇāṁ sahasreṣhu kaśhchid yatati siddhaye yatatām api siddhānāṁ kaśhchin māṁ vetti tattvataḥ","Among thousands of people, hardly one strives for perfection. Among those who strive, hardly one knows Me in truth.","Acknowledge the rarity of genuine, dedicated striving for spiritual perfection or self-realization ('siddhaye') among humanity ('manuṣhyāṇāṁ sahasreṣhu kaśhchit'), and the even greater rarity of attaining true, deep experiential wisdom ('kaśhchin māṁ vetti tattvataḥ') among those who strive. This understanding should inspire sincere and persistent effort in your own pursuits, humility regarding your progress, and deep appreciation for authentic knowledge and guidance when encountered. Value depth over superficiality."
8,5,"अन्तकाले च मामेव स्मरन्मुक्त्वा कलेवरम् | यः प्रयाति स मद्भावं याति नास्त्यत्र संशयः ||८-५||","anta-kāle cha mām eva smaran muktvā kalevaram yaḥ prayāti sa mad-bhāvaṁ yāti nāstyatra sanśhayaḥ","Whoever leaves the body remembering Me attains My nature. There is no doubt about this.","Understand the principle that one's predominant state of consciousness at the moment of death ('anta-kāle') strongly influences the subsequent state ('mad-bhāvam yāti'). Since this final thought ('smaran') is often the culmination of lifelong habitual thinking, cultivate a consistent focus on your highest values, purpose, or the Divine ('mām eva') throughout your life ('now'). What you practice consistently becomes your nature and determines your focus in critical moments, including the transition of death."
10,10,"तेषां सततयुक्तानां भजतां प्रीतिपूर्वकम् | ददामि बुद्धियोगं तं येन मामुपयान्ति ते ||१०-१०||","teṣhāṁ satata-yuktānāṁ bhajatāṁ prīti-pūrvakam dadāmi buddhi-yogaṁ taṁ yena mām upayānti te","To those steadfast in devotion, I give the yoga of understanding by which they come to Me.","To those who are constantly engaged ('satata-yuktānām') and serve or worship with sincere love and affection ('bhajatām prīti-pūrvakam'), the necessary divine understanding and discerning intelligence ('buddhi-yogam') is granted ('dadāmi'), enabling them to reach the ultimate goal ('yena mām upayānti te'). Approach your learning, work, or spiritual practice with consistent dedication and genuine heartfelt sincerity; this deep engagement attracts profound insights and guidance."
11,54,"भक्त्या त्वनन्यया शक्य अहमेवंविधोऽर्जुन | ज्ञातुं द्रष्टुं च तत्त्वेन प्रवेष्टुं च परन्तप ||११-५४||","bhaktyā tv ananyayā śhakya aham evaṁ-vidho ’rjuna jñātuṁ draṣhṭuṁ cha tattvena praveṣhṭuṁ cha parantapa","But only by undivided devotion can I be understood as I am, O Arjuna, seen directly, and entered into, O vanquisher of enemies.","(Verse 11.54 describes attaining the Cosmic Form through devotion. The Application provided earlier fits 11.55: 'मत्कर्मकृन्मत्परमो...' - 'mat-karma-kṛin mat-paramo...') Attain your highest potential or union with the Divine ('sa mām eti' - from 11.55) by integrating these key elements into your life: Perform your actions as service dedicated to a higher purpose ('mat-karma-kṛit'), make that purpose your supreme goal and refuge ('mat-paramah'), cultivate devotion and focused connection ('mad-bhaktaḥ'), remain free from selfish attachments ('saṅga-varjitaḥ'), and harbor no enmity or ill-will towards any being ('nirvairaḥ sarva-bhūteṣhu'). This holistic approach unites action, attitude, devotion, and ethics."
12,4,"ये त्वक्षरमनिर्देश्यमव्यक्तं पर्युपासते | सर्वत्रगमचिन्त्यं च कूटस्थमचलं ध्रुवम् ||१२-४||","ye tv akṣharam anirdeśhyam avyaktaṁ paryupāsate sarvatragam achintyaṁ cha kūṭastham achalaṁ dhruvam","(Verse 12.4 describes worship of the Impersonal Absolute.)","(The Application provided earlier fits 12.2: 'मय्यावेश्य मनो ये मां...' - 'mayy āveśhya mano ye māṁ...') Those individuals who fix their minds completely on their highest ideal or the Divine ('mayy āveśhya manaḥ'), engage constantly and steadfastly in practices that connect them to it ('nitya-yuktā upāsate'), and are endowed with supreme, unwavering faith ('śraddhayā parayopetāḥ'), are considered the most accomplished and perfectly integrated practitioners ('me yukta-tamāḥ matāḥ'). Wholehearted, faithful commitment yields the deepest connection and fulfillment."
13,28,"समं पश्यन्हि सर्वत्र समवस्थितमीश्वरम् | न हिनस्त्यात्मनात्मानं ततो याति परां गतिम् ||१३-२८||","samaṁ paśhyan hi sarvatra samavasthitam īśhvaram na hinasty ātmanātmānaṁ tato yāti parāṁ gatim","Because one who sees the Lord situated equally everywhere does not degrade himself by his mind. Thus he attains the supreme destination.","(Verse 13.28 explains the result of seeing equally. The Application provided earlier fits 13.27/28 concept: 'समं सर्वेषु भूतेषु...' - 'samaṁ sarveṣhu bhūteṣhu...') True perception ('saḥ paśhyati') lies in recognizing the one imperishable Supreme Reality ('parameśvaram avinaśhyantam') existing equally ('samam tiṣṭhantam') within all perishable beings and forms ('sarveṣhu bhūteṣhu vinaśhyatsu'). Cultivate this vision to look beyond temporary external differences (like appearance, status, species, opinions) and perceive the underlying unity and divinity in everyone and everything. This dissolves prejudice, fosters universal respect, and brings profound peace."
14,27,"ब्रह्मणो हि प्रतिष्ठाहममृतस्याव्ययस्य च | शाश्वतस्य च धर्मस्य सुखस्यैकान्तिकस्य च ||१४-२७||","brahmaṇo hi pratiṣhṭhāham amṛitasyāvyayasya cha śhāśhvatasya cha dharmasya sukhasyaikāntikasya cha","I am the foundation of Brahman, the immortal and imperishable, of eternal dharma, and of unending divine joy.","Recognize the personal aspect of the Divine ('Aham'/Krishna) as the ultimate foundation or abode ('pratiṣṭhā') supporting everything eternal and real: the impersonal Absolute Reality ('Brahmaṇaḥ'), immortality ('amṛitasya') and imperishability ('avyayasya'), eternal righteousness ('śāśvatasya dharmasya'), and ultimate, absolute, unwavering bliss ('sukhasya aikāntikasya'). Anchor your life, values, and quest for happiness in this eternal, unchanging source, rather than seeking lasting fulfillment in temporary worldly objects or experiences."
15,19,"यो मामेवमसम्मूढो जानाति पुरुषोत्तमम् | स सर्वविद्भजति मां सर्वभावेन भारत ||१५-१९||","yo mām evam asammūḍho jānāti puruṣhottamam sa sarva-vid bhajati māṁ sarva-bhāvena bhārata","One who knows Me as the Supreme Personality of Godhead, without delusion, attains all knowledge and worships Me wholeheartedly.","One who, free from delusion ('asammūḍhaḥ'), truly understands ('jānāti') the Divine ('Mām') as the Supreme Person ('Puruṣhottamam'), gains the essence of all knowledge ('saḥ sarva-vit' - knows the All). This profound understanding naturally leads to engaging in loving devotion and service with their entire being ('bhajati māṁ sarva-bhāvena'). True wisdom integrates intellect and heart, culminating in wholehearted, loving engagement with the Supreme Reality."
16,24,"तस्माच्छास्त्रं प्रमाणं ते कार्याकार्यव्यवस्थितौ | ज्ञात्वा शास्त्रविधानोक्तं कर्म कर्तुमिहार्हसि ||१६-२४||","tasmāch chāstraṁ pramāṇaṁ te kāryākārya-vyavasthitau jñātvā śhāstra-vidhānoktaṁ karma kartum ihārhasi","Therefore, let scripture be your authority in determining what should and should not be done. Understand scriptural injunctions and act accordingly.","In matters of discerning right conduct from wrong conduct ('kāryākārya-vyavasthitau'), let the wisdom enshrined in authentic scriptures and ethical teachings ('śhāstram') serve as your standard or authority ('pramāṇam'). First, seek to understand ('jñātvā') the principles and injunctions prescribed ('śhāstra-vidhānoktam'), and then endeavor to act ('karma kartum ihārhasi') in accordance with that understanding. When facing complex moral dilemmas, consult timeless wisdom rather than relying solely on fluctuating personal opinions or societal pressures."
17,28,"अश्रद्धया हुतं दत्तं तपस्तप्तं कृतं च यत् | असदित्युच्यते पार्थ न च तत्प्रेत्य नो इह ||१७-२८||","aśhraddhayā hutaṁ dattaṁ tapas taptaṁ kṛitaṁ cha yat asad ity uchyate pārtha na cha tat pretya no iha","Anything done as sacrifice, charity, or penance without faith is called 'asat' (unreal). It is useless here and hereafter.","Understand that any act of sacrifice ('hutam'), charity ('dattam'), austerity ('tapas taptam'), or any other action ('kṛitam cha yat') performed without sincere faith, conviction, and reverence ('aśraddhayā') is termed 'asat' – unreal, ineffective, or counterproductive. Such actions yield no true benefit, either in this life ('na iha') or the next ('na pretya'). The inner attitude and sincerity ('śraddhā') behind an action are paramount; perform duties and practices with genuine belief and commitment."
18,46,"यतः प्रवृत्तिर्भूतानां येन सर्वमिदं ततम् | स्वकर्मणा तमभ्यर्च्य सिद्धिं विन्दति मानवः ||१८-४६||","yataḥ pravṛittir bhūtānāṁ yena sarvam idaṁ tatam sva-karmaṇā tam abhyarchya siddhiṁ vindati mānavaḥ","By worshiping the Supreme, from whom all beings originate and by whom all this is pervaded, humans can attain perfection through their duties.","Attain perfection or fulfillment ('siddhiṁ vindati mānavaḥ') by performing your own natural work and duties ('svakarmaṇā') as an act of worship ('tam abhyarchya') directed towards the Supreme Source from whom all beings emanate ('yataḥ pravṛittiḥ bhūtānām') and by whom the entire universe is pervaded ('yena sarvam idaṁ tatam'). See your unique work, performed with dedication and excellence, as your specific and effective way of honoring and connecting with the divine intelligence underlying all existence."
18,65,"मन्मना भव मद्भक्तो मद्याजी मां नमस्कुरु | मामेवैष्यसि सत्यं ते प्रतिजाने प्रियोऽसि मे ||१८-६५||","man-manā bhava mad-bhakto mad-yājī māṁ namaskuru mām evaiṣhyasi satyaṁ te pratijāne priyo ’si me","Always think of Me, become My devotee, worship Me and offer your homage unto Me. Thus you will come to Me without fail. I promise you this because you are My very dear friend.","(Slight variation in wording, but same core message as the previously listed 18.65). Embrace the path of devotion as the most direct means to attain union with the Divine: Constantly fix your mind on your highest ideal ('man-manā bhava'), become Its dedicated devotee ('mad-bhaktaḥ'), perform all actions as worship offered to It ('mad-yājī'), and offer obeisance with reverence and humility ('māṁ namaskuru'). By thus uniting your entire being – mind, heart, actions – with the Supreme as your ultimate refuge, you will surely attain It ('mām evaiṣhyasi'). This is the essence of complete surrender."
2,3,"क्लैब्यं मा स्म गमः पार्थ नैतत्त्वय्युपपद्यते | क्षुद्रं हृदयदौर्बल्यं त्यक्त्वोत्तिष्ठ परन्तप ||२-३||","klaibyaṁ mā sma gamaḥ pārtha naitat tvayy upapadyate kṣhudraṁ hṛidaya-daurbalyaṁ tyaktvottiṣhṭha parantapa","Arjuna, it does not befit you to yield to this unmanliness. Give up such petty weakness of heart and arise, O vanquisher of enemies.","Do not succumb to paralyzing weakness, impotence, or faint-heartedness ('klaibyam,' 'kṣhudraṁ hṛidaya-daurbalyam') when facing daunting challenges, ethical dilemmas, or necessary duties (like exams, presentations, difficult conversations). Recognize that such debilitating negativity does not align with your inherent strength and potential ('naitat tvayy upapadyate'). Consciously reject this despondency ('tyaktvā'), summon your inner courage and resolve, and stand up ('uttiṣṭha') to meet the situation, O capable individual ('Parantapa')."
2,49,"दूरेण ह्यवरं कर्म बुद्धियोगाद्धनञ्जय | बुद्धौ शरणमन्विच्छ कृपणाः फलहेतवः ||२-४९||","dūreṇa hy avaraṁ karma buddhi-yogād dhanañjaya buddhau śharaṇam anvichchha kṛipaṇāḥ phala-hetavaḥ","Action is far inferior to the yoga of wisdom, O Arjuna. Seek refuge in wisdom—pitiful are those motivated by results.","Understand that mechanical action ('karma') performed without guiding wisdom is vastly inferior ('dūreṇa hy avaram') to actions performed with enlightened intelligence and understanding ('buddhi-yogāt'). Therefore, consciously seek refuge ('śharaṇam anvichchha') in this higher intelligence or wisdom ('buddhau'). Those who are solely motivated by the fruits or results of their actions ('phala-hetavaḥ') are considered 'kṛipāṇāḥ' (miserly, pitiful) because they miss the broader perspective, inner freedom, and true purpose that wisdom provides. Prioritize understanding."
3,8,"नियतं कुरु कर्म त्वं कर्म ज्यायो ह्यकर्मणः | शरीरयात्रापि च ते न प्रसिद्ध्येदकर्मणः ||३-८||","niyataṁ kuru karma tvaṁ karma jyāyo hy akarmaṇaḥ śharīra-yātrāpi cha te na prasiddhyed akarmaṇaḥ","You should perform your prescribed duties, for action is better than inaction. Even maintaining your body would be impossible without action.","Consistently perform your prescribed or necessary duties ('niyataṁ kuru karma') because engaging in required action ('karma') is inherently superior ('jyāyaḥ') to falling into inertia or inaction ('akarmaṇaḥ'). Recognize that even the basic maintenance of your physical existence ('śarīra-yātrā api') depends on continuous action. Overcome procrastination and apathy; engage actively, responsibly, and purposefully with your life and responsibilities."
3,9,"यज्ञार्थात्कर्मणोऽन्यत्र लोकोऽयं कर्मबन्धनः | तदर्थं कर्म कौन्तेय मुक्तसङ्गः समाचर ||३-९||","yajñārthāt karmaṇo ’nyatra loko ’yaṁ karma-bandhanaḥ tad-arthaṁ karma kaunteya mukta-saṅgaḥ samāchara","Work done as sacrifice for Vishnu frees one from karmic bondage. Therefore, O Arjuna, perform your duties as offerings, free from attachment.","Understand that actions ('karma') create binding reactions and consequences ('karma-bandhanaḥ') when performed with selfish motives ('anyatra' - other than for Yajna). However, when work is performed as a sacrifice ('yajñārthāt') – offered selflessly for a higher purpose, the common good, or the Divine – it leads to liberation. Therefore, perform your duties ('tad-arthaṁ karma') with this spirit of selfless offering, free from personal attachment ('mukta-saṅgaḥ'). This transforms work from a potential source of entanglement into a path of freedom and spiritual growth."
4,18,"कर्मण्यकर्म यः पश्येदकर्मणि च कर्म यः | स बुद्धिमान्मनुष्येषु स युक्तः कृत्स्नकर्मकृत् ||४-१८||","karmaṇyakarma yaḥ paśhyed akarmaṇi cha karma yaḥ sa buddhimān manuṣhyeṣhu sa yuktaḥ kṛitsna-karma-kṛit","One who sees inaction in action and action in inaction is wise among humans. Such a person is a yogi who has accomplished all work.","The truly wise person ('saḥ buddhimān') perceives the element of stillness, non-doership, or the uninvolved Self ('akarma') even amidst dynamic activity ('karmaṇi'). They also recognize the subtle action, potential, or mental engagement ('karma') present even in apparent physical inaction ('akarmaṇi'). Cultivating this insight allows one to act effectively in the world without being bound by ego or results, remaining inwardly detached and peaceful ('saḥ yuktaḥ'). This wisdom integrates action and contemplation."
4,33,"श्रेयान्द्रव्यमयाद्यज्ञाज्ज्ञानयज्ञः परन्तप | सर्वं कर्माखिलं पार्थ ज्ञाने परिसमाप्यते ||४-३३||","śhreyān dravya-mayād yajñāj jñāna-yajñaḥ parantapa sarvaṁ karmākhilaṁ pārtha jñāne parisamāpyate","The sacrifice of knowledge is superior to material sacrifices, O Arjuna, for all actions culminate in wisdom.","Value the pursuit, cultivation, and sharing of knowledge and wisdom ('jñāna-yajñaḥ') as a superior form of sacrifice or offering ('śhreyān') compared to sacrifices performed merely with material objects or wealth ('dravya-mayāt yajñāt'). Understand that the ultimate purpose and fulfillment ('parisamāpyate') of all dedicated actions ('sarvam karma akhilam') lies in the attainment of wisdom ('jñāne'). Prioritize learning, understanding, and spiritual insight."
4,38,"न हि ज्ञानेन सदृशं पवित्रमिह विद्यते | तत्स्वयं योगसंसिद्धः कालेनात्मनि विन्दति ||४-३८||","na hi jñānena sadṛiśhaṁ pavitram iha vidyate tat svayaṁ yoga-sansiddhaḥ kālenātmani vindati","There is nothing as purifying as knowledge in this world. Those perfected in yoga find it in due course within themselves.","Recognize that in this world ('iha'), there exists no purifier as potent and sublime ('pavitram sadṛiśham') as true knowledge or wisdom ('jñānena'). This profound wisdom is not merely acquired intellectually but is realized directly within oneself ('ātmani') in the course of time ('kālena') by one who becomes perfected through the dedicated and consistent practice of yoga ('tat svayam yoga-sansiddhaḥ vindati'). Persist in your practice with faith; clarity purifies the mind."
5,2,"श्रीभगवानुवाच | संन्यासः कर्मयोगश्च निःश्रेयसकरावुभौ | तयोस्तु कर्मसंन्यासात्कर्मयोगो विशिष्यते ||५-२||","śhrī bhagavān uvācha sannyāsaḥ karma-yogaśh cha niḥśhreyasa-karāv ubhau tayos tu karma-sannyāsāt karma-yogo viśhiṣhyate","Both renunciation of action and karma yoga lead to liberation. But of the two, karma yoga is superior to mere renunciation.","While both the path of formal renunciation of actions ('sannyāsaḥ') and the path of performing actions selflessly ('karma-yogaḥ') can lead to the highest good or liberation ('niḥśreyasa-karau ubhau'), engaging skillfully in action with detachment (Karma Yoga) is considered more effective and practical ('viśhiṣhyate') for most people than simply abstaining from action ('karma-sannyāsāt'). Actively participate in life and fulfill your duties, but cultivate inner detachment, rather than seeking liberation solely through withdrawal."
